product_name,product_description,product_price,product_image_url
ゴルフ,PLAY GREEN スプレーダイ ショートパンツ,"6,298",リサイクル素材を一部使用した、斬新なデザインのショートパンツ。
オリジナルス,アディカラー エッセンシャルズ トレフォイルパンツ,"4,394",一日中気持ち良く過ごせる、スタイリッシュなイージーパンツ。
ジム・トレーニング,D4T HIIT 総柄プリント トレーニングショーツ,"3,300",暑い日のトレーニングに適した、リサイクル素材を一部用いたショーツ。
ジム・トレーニング,HIIT メッシュ トレーニングショーツ,"3,465",リサイクル素材で作られた、ポプリンとメッシュのトレーニングショーツ。
サッカー,Entrada 22 ショーツ,"2,490",リサイクル素材を一部使用した、吸湿性に優れたサッカーショーツ。
オリジナルス,Reveal 異素材ミックス ショーツ,"4,125",リサイクル素材を使用した、ユーティリタリアンなカーゴショーツ。
ゴルフ,アディクロス フトゥーラ ショーツ,"6,293",リサイクル素材で作られた、マルチに使えるゴルフショーツ。
ジム・トレーニング,AEROREADY デザインド フォー ムーブメント トレーニングパンツ,"4,389",リサイクル素材を一部使用した、動きやすいトレーニングパンツ。
ゴルフ,ADICROSS ライトウェイトチノ アンクルパンツ,"4,670",クラシックな雰囲気の動きやすいゴルフパンツ。
ゴルフ,EX STRETCH テープディテール ストレッチツイル アンクルパンツ,"3,364",ゴルフコースでパフォーマンスを発揮するためのスポーティーなパンツ。
スポーツウェア,フューチャーアイコン エンブロイダード バッジ オブ スポーツパンツ,"8,800",天然素材を使用した、とびきりソフトなジョガーパンツ。
オリジナルス,グラフィック カモ柄 ショーツ,"6,600",カモフラージュ柄をアクセントにした、快適なはき心地のショーツ。
オリジナルス,アディカラー パーレイ トラックパンツ,"13,200",パーレイ・オーシャン・プラスチックを一部使用した、トラックパンツ。
スポーツウェア,ラウンジ フリースパンツ,"10,450",ウエストにドローコードが付いた、暖かいスウェットパンツ。
オリジナルス,アディダス アドベンチャー プレミアムパンツ,"28,600",アウトドアにインスパイアされたデザインの、街にも似合うパンツ。
オリジナルス,アディカラー エッセンシャルズ トレフォイルパンツ,"6,152",一日中気持ち良く過ごせる、スタイリッシュなイージーパンツ。
ジム・トレーニング,AEROREADY デザインド フォー ムーブメント トレーニングパンツ,"6,270",リサイクル素材を一部使用した、動きやすいトレーニングパンツ。
スポーツウェア,PRSVE ウォーム ウーブンパンツ,"8,800",リサイクル素材を一部使用した、複数ポケットを備えた多目的パンツ。
オリジナルス,アディダス アドベンチャー プレミアムパンツ,"28,600",アウトドアにインスパイアされたデザインの、街にも似合うパンツ。
オリジナルス,アディカラー クラシックス アディブレイク トラックパンツ（ジャージ）,"12,100",リサイクル素材で一新した、アイコニックなスナップパンツ。
オリジナルス,アディマティック ヘンプ / ADIMATIC HEMP,"13,200",スケートボーディングにインスパイアされた、カジュアルな一足。
オリジナルス,キャンパス 80 クロップ / Campus 80 Crop,"14,300",人気のキャンパス 80に、取り外しできるオーバーレイをプラス。
オリジナルス,SST SUPERMODIFIED HEMP,"16,500",天然素材で作られた、Y2Kを彷彿とさせる一足。
オリジナルス,アディマティック ヘンプ / ADIMATIC HEMP,"13,200",スケートボーディングにインスパイアされた、カジュアルな一足。
オリジナルス,NMD S1,"35,200",高反発アウトソールを搭載した、快適でスタイリッシュなレザーシューズ。
オリジナルス,NMD S1,"35,200",高反発アウトソールを搭載した、快適でスタイリッシュなレザーシューズ。
オリジナルス,adidas Originals × Hello Kitty and Friends アディダス アスター / adidas ASTIR,"13,200",リサイクル素材を一部使用した、ハローキティとのコラボシューズ。
オリジナルス,adidas Originals × Hello Kitty and Friends フォーラム ボネガ / Forum Bonega,"15,400",リサイクル素材を一部使用した、ハローキティとのコラボシューズ。
オリジナルス,adidas Originals × Hello Kitty and Friends スタンスミス / STAN SMITH,"15,400",リサイクル素材を一部使用した、ハローキティとのコラボシューズ。
オリジナルス,スタンスミス Lux / Stan Smith Lux,"16,500",時代を超えて愛されるデザインの、プレミアムなスタンスミス。
オリジナルス,スタンスミス / Stan Smith,"10,890",不朽の名作、永遠のアイコニック。スタンスミスは、サステナブルへ。
オリジナルス,スタンスミス / Stan Smith,"10,890",不朽の名作、永遠のアイコニック。スタンスミスは、サステナブルへ。
オリジナルス,SUPERSTAR MILLENCON W,"15,400",
オリジナルス,アディダス ニッツァ× ムーミン プラットフォーム ミッド / adidas Nizza × Moomin Platform Mid,"10,450",遊び心を纏った、ムーミンとのコラボから生まれた厚底シューズ。
オリジナルス,アディダス アスター / adidas ASTIR W,"12,100",リサイクル素材を一部使用した、ランニングスタイルのシューズ。
オリジナルス,NY 90,"8,990",リサイクル素材を一部使用した、マルチなデイリースニーカー。
オリジナルス,スーパースター 82 / Superstar 82,"17,600",80年代モデルを復刻した、タイムレスな一足。
オリジナルス,スタンスミス リコン / Stan Smith Recon,"20,900",古くて新しいスタンスミス。
オリジナルス,BEAUTY&YOUTH スタンスミス / Stan Smith,"10,010",リサイクル素材を一部用いたタイムレスなスニーカー。
オリジナルス,スタンスミス / Stan Smith,"14,300",落ち着いたアースカラーをまとったスタンスミス。
オリジナルス,ピノキオ スタンスミス / Pinocchio Stan Smith ディズニー,"10,010",リサイクル素材を一部使用した、ディズニーとのコラボスニーカー。
オリジナルス,NMD_S1,"23,100",パーレイ・オーシャン・プラスチックを一部用いた、ミニマルなシューズ。
オリジナルス,サンバ / Samba,"18,700",エフォートレスに毎日のスタイリングをまとめる、クラシックシューズ。
オリジナルス,スタンスミス / Stan Smith,"15,400",間違いのないタイムレスなシューズ、スタンスミス。
オリジナルス,スーパースター 82 / Superstar 82,"19,800",リサイクル&ヴィーガン素材で作られた、ナチュラルカラーのアイコン。
オリジナルス,アディダス アスター / adidas astir,"12,100",リサイクル素材を一部使用した、自分らしいスタイルを楽しめるシューズ。
Y-3,Y-3 ITOGO,"84,700",フットウエアのライフサイクルを再考するように設計された「Y-3 ITOGO」。
オリジナルス,スタンスミス ハー ヴィーガン / Stan Smith Her Vegan,"10,010",リサイクルヴィーガン素材を使用した、ジューシーな雰囲気漂う一足。
オリジナルス,スタンスミス / Stan Smith,"14,300",リサイクル素材を一部使用した、コートスタイルのシンプルなスニーカー。
オリジナルス,キャンパス 80s / Campus 80s,"14,300",新鮮な色使いで伝説的シューズをアップデート。
オリジナルス,スタンスミス / Stan Smith,"15,400",リサイクル素材を一部使用した、テニスコートのクラシック。
オリジナルス,スーパースター80s タニー / SUPERSTAR 80s TANY,"19,800",「TOKYO ENERGY」コレクションの第六弾
オリジナルス,スタンスミス リコン / Stan Smith Recon,"23,100",ひと目でそれとわかる、ぜいたくなレザースニーカー。
オリジナルス,スーパースター / Superstar,"7,623",シェルトゥを備えた、オーセンティックなローカットモデル。
オリジナルス,ガゼル インドア / Gazelle Indoor,"20,900",上質な素材で生まれ変わった、クラシックなガゼル。
スポーツウェア,ウルトラ アディダス 4D / Ultra adidas 4D,"31,900",リサイクル素材を一部使用したフューチャリスティックなスニーカー。
オリジナルス,SST Millencon,"15,400",ウェイブを描く厚底ソールで、アディダスの名作を一新。
オリジナルス,スタンスミス / Stan Smith,"10,010",リサイクル素材を一部使用した、不朽の名作、スタンスミス。
オリジナルス,キャンパス 80s / Campus 80s,"10,010",ロサンゼルスのカルチャーにスポットライトを当てたキャンパス。
オリジナルス,Nucombe,"17,600",スタイリッシュで耐久性に優れたレザーシューズ。
スポーツウェア,グランドコート / Grand Court,"5,775",快適な履き心地をかなえる、アイコニックな一足。
スポーツウェア,X_PLRBOOST,"25,300",リサイクル素材を一部使用した、移動に活躍するBOOSTシューズ。
オリジナルス,Retropy E5,"14,300",リサイクル素材を一部使用した、クッション性の高いランニングスタイルの一足。
オリジナルス,STAN SMITHTOMORROWLAND,"15,400",毎日ラクに履きこなせる、タイムレスなスニーカー。
オリジナルス,ニッツァ RF スリッポン / Nizza RF Slip-On,"9,350",デイリースタイルの履きやすいスリッポンシューズ。
オリジナルス,スタンスミス ヴィーガン / Stan Smith Vegan,"14,300",リサイクルヴィーガン素材を用いた、アイスクリームをモチーフにしたスニーカー。
スポーツウェア,デュラモ SL / Duramo SL,"5,490",グリップ力のある丈夫なアウトソールを備えたキッズシューズ。
オリジナルス,フォーラム 84 ロー / Forum 84 Low,"18,700",スポーツ界と音楽界でも愛された80sの人気スニーカーをアップデート。
オリジナルス,NMD_V3,"14,630",パーレイ・オーシャン・プラスチックを一部使用した、高反発シューズ。
オリジナルス,adidas × Gucci メンズ ZX8000 / adidas × Gucci men’s ZX8000,"139,700",adidas x Gucciコレクションのトルションシューズ。
スポーツウェア,ウルトラブースト 5 DNA ランニング ライフスタイル / Ultraboost 5 DNA Running Lifestyle,"16,940",パーレイ・オーシャン・プラスチックを一部用いたデイリーシューズ。
オリジナルス,スーパースター / Superstar,"10,780",リサイクル素材を一部使用した、防水スニーカー。
オリジナルス,フォーラム ミッド / Forum Mid,"14,300",バスケットボールの伝統を受け継ぐ、80年代が着想源の一足。
オリジナルス,スーパースター / Superstar,"11,440",スネークスキングラフィックが目を引く、リサイクル素材を一部使用したスーパースター。
オリジナルス,スタンスミス / Stan Smith,"14,300",伝説的なテニススタイルシューズをモダンにリメイク。
オリジナルス,キャンパス 80s / Campus 80s,"15,400",滑らかなレザーを用いた、スリーストライプスのエネルギー漂うクラシックスニーカー。
スポーツウェア,ストリートチェック Cloudfoam コートロー / Streetcheck Cloudfoam Court Low,"4,125",毎日のアクティビティに対応する、バッシュスタイルのシューズ。
オリジナルス,Retropy E5,"14,300",快適でスタイリッシュな70年代風デイリースニーカー。
オリジナルス,フォーラム 84 ロー AEC / Forum 84 Low AEC,"22,000",リサイクル素材を一部使用した、愛着感じるフォーラムシューズ。
オリジナルス,キャンパス 00s / Campus 00s,"13,200",友情を讃えてデザインした、新鮮味あふれるキャンパスシューズ。
オリジナルス,スタンスミス ボネガ 2B / Stan Smith Bonega 2B,"15,400",自然とのコラボレーションから生まれた、厚底スタンスミス。
オリジナルス,キャンパス / Campus,"19,800",FOOT INDUSTRYとタッグを組んで進化を遂げたキャンパス。
オリジナルス,フォーラム 84 ロー / Forum 84 Low,"14,300",ヘビ柄プリントでリメイクした、クラシックなローカットシューズ。
オリジナルス,スーパースター / Superstar,"10,010",レガシーを輝かせる、レザーのスーパースターシューズ。
オリジナルス,タバコ / Tobacco,"14,300",アーカイブをベースにデザインした、ネオクラシックモデル。
オリジナルス,スタンスミス / Stan Smith,"10,010",リサイクル素材を一部用いたタイムレスなスニーカー。
オリジナルス,スーパースター / Superstar,"13,200",名作のスケートシューズを忠実に復刻。
オリジナルス,スーパースター / Superstar,"10,010",リサイクル素材を一部使用した、サッカーナショナルチームのカラーをまとったタイムレスなスニーカー。
オリジナルス,Retropy E5,"13,500",アーカイブのレトロなランニングシューズがモダンなスタイルで復刻。
オリジナルス,ハローキティ adidas Astir / Hello Kitty adidas Astir,"9,240",リサイクル素材を一部使用した、ハローキティとのコラボシューズ。
オリジナルス,NMD_R1 テベ・マググ / NMD_R1 Thebe Magugu,"13,090",リサイクル素材を一部使用した、テベ・マググとのコラボシューズ。
オリジナルス,フォーラム ロー / Forum Low,"8,470",リサイクル素材を一部使用した、パーレイ × フォーラム。
Y-3,Y-3 SST,"48,400",伝統的な刺し子からヒントを得て、Y-3が人気シューズをアップデート。
オリジナルス,URBAN RESEARCH スタンスミス / STAN SMITH UR,"10,010",リサイクル素材を一部用いたタイムレスな定番スニーカー。
オリジナルス,フォーラムボールド / ForumBold,"10,560",80年代調クラシックシューズを、パイソンプリントでアップデート。
オリジナルス,NMD_S1,"23,100",パーレイ・オーシャン・プラスチックを一部用いた、ミニマルなシューズ。
Y-3,Y-3 Ajatu Court Low,"48,400",研ぎ澄まされたY-3の感性漂う、バッシュスタイルのスニーカー。
オリジナルス,スタンスミス / Stan Smith,"14,300",オリジナルのデザインを踏襲した、クラシックなスタンスミス。
オリジナルス,Adi2000,"15,400",リサイクル素材を一部使用した、目を引くスネークスキン柄のシューズ。
オリジナルス,スタンスミス / Stan Smith,"10,010",リサイクル素材を一部使用した、カラフルなスタンスミス。
オリジナルス,スタンスミス / Stan Smith,"10,010",リサイクル素材を一部使用した、ラギッドスタイルのスタンスミス 。
オリジナルス,FORUM MILLENCON W,"15,400",
Y-3,Y-3 RIVALRY,"60,500",ライバルリーをヒントにした、存在感のあるY-3シューズ。
オリジナルス,プイグ / Puig,"12,100",ルーカス・プイグが手掛けた、インドアスタイルのスケートシューズ。
オリジナルス,ノラ / Nora,"12,100",スケートボーディング向けにノラが手掛けた、テニススタイルのシューズ。
オリジナルス,フォーラムボールド / ForumBold,"8,470",安定性を高めるTPUヒールピースと厚底デザインが特徴のフォーラム。
オリジナルス,スーパースター / Superstar,"11,440",リサイクル素材を一部使用したスタイリッシュなシューズ。
Y-3,Y-3 RIVALRY,"60,500",ライバルリーをヒントにした、存在感のあるY-3シューズ。
オリジナルス,NMD_R1,"13,090",レトロなランニングシューズが着想源のミニマルな一足。
オリジナルス,Adi2000,"13,200",Y2Kのムードを漂わせる、頼りになるシューズ。
オリジナルス,ハイパーターフ アドベンチャー / Hyperturf Adventure,"12,320",リサイクル素材を一部用いた、アウトドアタッチのタウンシューズ。
バイ ステラ マッカートニー,adidas by Stella McCartney コート スリッポン / adidas by Stella McCartney Court Slip-On,"23,100",自然に優しいデザインの、厚底キャンバス スニーカー。
オリジナルス,ライバルリー ロー 86 / Rivalry Low 86,"18,700",80年代のムードに新しさを加えたローカットシューズ。
オリジナルス,キャンパス 00s / Campus 00s,"13,200",モダンなひねりを加えたクラシックなキャンパス。
オリジナルス,アディフォーム SLTN / Adifom SLTN,"12,100",リサイクル素材を一部使用した、フォーム使いの快適なシューズ。
オリジナルス,スタンスミス / Stan Smith,"12,320",リサイクル素材を一部使用したクラシックなスタンスミス。
オリジナルス,サンバチーム / Samba Team,"13,200",バイエルン・ミュンヘンのホームカラーを纏ったクラシックなサンバシューズ。
オリジナルス,ガゼル インドア / Gazelle Indoor,"22,000",独特のルックスが根強い人気のガゼル インドアシューズ。
オリジナルス,SUPERSTAR 82 FI,"15,400",SUPERSTAR 82 FI
オリジナルス,アディダス アスター/ adidas Astir,"6,050",グリップ力と快適性に優れる丈夫なスニーカー。
オリジナルス,スーパースター / Superstar,"10,010",リサイクル素材を一部用いた、バタフライプリントのスーパースター。
オリジナルス,アディフォーム SLTN / Adifom SLTN,"6,050",リサイクル素材を一部使用した、フォーム使いの快適なシューズ。
オリジナルス,スタンスミス / Stan Smith,"14,300",カレッジスタイルを纏った、アディダスを象徴するレザースニーカー。
オリジナルス,スーパースター / Superstar,"14,300",ゴールドカラーをアクセントにした、人気のシェルトゥスニーカー。
オリジナルス,CAMPUS 80s KIKS LAB,"14,300",アンダーグラウンドな香り漂う、サブカルチャースタイル。
スポーツウェア,ZNCHILL スポーツウェア カプセルコレクション,"14,300",リサイクル素材を一部使用した、新技術が詰まったスポーティースニーカー。
オリジナルス,マッチブレイクスーパー / MatchbreakSuper,"10,450",高品質なスケートボーディング用バルカナイズドシューズ。
スポーツウェア,アドバンコート ベース / Advancourt Base,"6,600",合成皮革アッパーで履きやすい、爽やかなコート系シューズ。
オリジナルス,ニッツァ RF [Nizza RF Shoes],"4,675",ビンテージのバッシュスタイルに仕上げた、カジュアルなスニーカー。
オリジナルス,モアナと伝説の海 モアナ スタンスミス / Moana Stan Smith ディズニー,"10,010",リサイクル素材を一部使用した、足元が華やかになるディズニーとのコラボシューズ。
スポーツウェア,Multix,"8,470",シチュエーションを選ばない、オールラウンダー。
オリジナルス,NMD_S1,"23,100",パーレイ・オーシャン・プラスチックを一部用いた、ミニマルなシューズ。
バイ ステラ マッカートニー,adidas by Stella McCartney スポーツウェア / adidas by Stella McCartney Sportswear,"38,500",BOOSTミッドソールを搭載した、スタイリッシュなデイリーシューズ。
オリジナルス,スタンスミス / Stan Smith,"14,300",リサイクル素材を一部使用したアディダス スタンスミス。
オリジナルス,スタンスミス / Stan Smith,"23,100",リサイクル&ヴィーガン素材で作られた、クラシックなスタンスミス。
オリジナルス,スーパースター / Superstar,"13,200",永遠にスタイリッシュな、アイコンスニーカー。
バイ ステラ マッカートニー,adidas by Stella McCartney スポーツウェア / adidas by Stella McCartney Sportswear,"38,500",BOOSTミッドソールを搭載した、スタイリッシュなデイリーシューズ。
オリジナルス,NMD_V3,"10,450",パーレイ・オーシャン・プラスチックを一部使用した、モダンなNMD。
オリジナルス,スタンスミス / Stan Smith,"13,500",リサイクル素材を一部使用したアディダス スタンスミス。
オリジナルス,ライオン・キング スカー スタンスミス / Scar Stan Smith ディズニー,"10,780",リサイクル素材を一部使用した、ディズニーとのコラボスニーカー。
オリジナルス,Roverend,"27,500",
スポーツウェア,AVRYN U,"19,800",リサイクル素材を一部使用した、スタイリッシュなスニーカー。
オリジナルス,フォーラム ロー / Forum Low,"8,470",リサイクル素材を一部使用した、女性を讃えるフォーラム。
オリジナルス,フォーラム 84 ハイ / Forum 84 High,"16,000",快適なデザインのレトロなシューズ。
オリジナルス,タイショーン ロー / Tyshawn Low,"12,500",オールホワイトレザーが美しい、タイショーン ローカットモデル。
オリジナルス,スーパースター / Superstar,"10,010",CORDURA®とリサイクル素材を一部使用した、レトロなスニーカー。
オリジナルス,NMD_V3,"20,900",パーレイ・オーシャン・プラスチックを一部使用した、先進的なシューズ。
オリジナルス,ガゼルボールド / Gazelle Bold,"13,200",大胆な進化を遂げた、クラシック ガゼル。
スポーツウェア,ウルトラブースト 5 DNA ランニング スポーツウェア ライフスタイル / Ultraboost 5 DNA Running Sportswear Lifestyle,"24,200",パーレイ・オーシャン・プラスチックを一部用いたデイリーシューズ。
スポーツウェア,アドバンコート / Advancourt,"5,929",クラシックなスタイルをモダンにアップデート。
オリジナルス,Retropy E5,"10,010",リサイクル素材を一部使用した、70's風のモダンな履き心地の一足。
オリジナルス,FORUM 84 CAMP LOW,"17,600",キャンプギアからインスピレーションを受けたフォーラム84ロー
スポーツウェア,ウルトラブースト 1.0 / Ultraboost 1.0,"25,300",エネルギーの反発が感じられる、パーレイ・オーシャン・プラスチック素材を一部使用したシューズ。
オリジナルス,スーパースター / Superstar,"10,010",レガシーを輝かせる、レザーのスーパースターシューズ。
オリジナルス,ハイパーターフ アドベンチャー / Hyperturf Adventure,"8,800",リサイクル素材を一部用いた、アウトドアタッチのタウンシューズ。
バイ ステラ マッカートニー,adidas by Stella McCartney コート / adidas by Stella McCartney Court,"25,300",地球に優しい素材で作られた厚底シューズ。
オリジナルス,ライバルリー ハイ / Rivalry Hi,"14,300",クラシックなバッシュをリメイク。
オリジナルス,ライバルリー ロー / Rivalry Low,"16,500",童心をセレブレートするレトロなキャンバススニーカー。
オリジナルス,フォーラム ミッド / Forum Mid,"10,010",面ファスナー式のアンクルストラップを備えた懐かしいデザイン。
オリジナルス,ニッツァ RF [Nizza RF Shoes],"6,545",ビンテージのバッシュスタイルに仕上げた、カジュアルなスニーカー。
オリジナルス,ガゼル 85 / Gazelle 85,"18,700",1985年デビューのガゼルを、プレミアムな素材を使って復刻。
オリジナルス,フォーラム 84 ハイ / Forum 84 High,"18,700",無限のスタイリングが楽しめる、懐かしくて快適なハイカットスニーカー。
オリジナルス,スタンスミス / Stan Smith,"10,010",リサイクル素材を一部用いたタイムレスな定番スニーカー。
オリジナルス,フォーラム 84 ロー / Forum 84 Low,"13,200",80年代のバッシュにインスパイアされたプレミアムレザーシューズ。
オリジナルス,CAMPUS 80s EMMI,"14,300",アンダーグラウンドな香り漂う、サブカルチャースタイル。
オリジナルス,サンバ ヴィーガン クリスマス /  Samba Vegan Christmas,"11,000",リサイクルヴィーガン素材を一部使用した、華やかなサンバシューズ。
オリジナルス,adi2000,"9,240",リサイクル素材を一部使用した、オールホワイト スニーカー。
オリジナルス,ガゼルボールド / Gazelle Bold,"13,200",リュクスなエッジが効いた、クラシックな'90sスタイル。
