product_name,product_description,product_price,product_image_url
オリジナルス,キャンパス 80s / Campus 80s,"10,010",日本の伝統工芸、刺し子をモチーフにしたスエードシューズ。
オリジナルス,スタンスミス / Stan Smith,"10,010",カスタマイズが楽しめる、リサイクル素材を一部使用したスタンスミス。
オリジナルス,スタンスミス / Stan Smith,"10,010",リサイクル素材を一部使用した、進化したシグネチャーシューズ。
スポーツウェア,Tensaur ラン / Tensaur Run,"2,541",リサイクル素材を一部使用した、ベビー向けの快適なランニングシューズ。
オリジナルス,スーパースター 82 / Superstar 82,"19,800",脱構築的なデザインが目を引くスーパースター。
スポーツウェア,ウルトラブースト 1.0 DNA ランニング スポーツウェア ライフスタイル / Ultraboost 1.0 DNA Running Sportswear Lifestyle,"18,480",パーレイ・オーシャン・プラスチックを一部使用した、サンデビルズファンに贈るランニングシューズ。
オリジナルス,スタンスミス / Stan Smith,"10,010",リサイクル素材を一部使用したクラシックなスタンスミス。
オリジナルス,ゴンズ アロハ / Gonz Aloha,"13,200",ゴンズの功績を着想源にした、大胆な配色とアートが目を引く一足。
オリジナルス,フォーラム ロー / Forum Low,"8,470",レトロなバスケットボールスタイルのアディダス フォーラム ロー。
オリジナルス,NMD_R1,"18,700",パーレイ・オーシャン・プラスチックを一部使用した、スリッポンタイプのNMD_R1シューズ。
スポーツウェア,ライトレーサーアダプト 4.0 クラウドフォーム スリッポン / Lite Racer Adapt 4.0 Cloudfoam Slip-On,"7,370",リサイクル素材を一部使用した、スポーティーなスリッポンシューズ。
オリジナルス,LA トレーナー ライト / LA Trainer Lite,"4,543",元気いっぱいのキッズに贈る、屈曲性に優れたシューズ。
スポーツウェア,Showtheway 2.0,"4,235",リサイクル素材を一部用いた、一日中快適なランニングシューズ。
スポーツウェア,レーサー TR21 / Racer TR21,"8,470",ランニングスタイルをデザインに取り入れたデイリーシューズ。
オリジナルス,シャドウターフ / Shadowturf,"17,600",サマーキャンプからインスピレーションを得たシャドウターフ。
オリジナルス,フォーラム 84 ハイ / Forum 84 High,"16,500",モダンなタッチを添えた、オーセンティックなフォーラム。
オリジナルス,ブセニッツ プロ / Busenitz Pro,"12,500",コントロール性もプラスした、新しいブセニッツ プロ。
オリジナルス,フォーラム ミッド / Forum Mid,"14,300",80年代の空気を纏ったプレミアムなミッドカットシューズ。
オリジナルス,フォーラム ロー / Forum Low,"8,470",リサイクル素材を一部用いた、モダンなフォーラム ロー。
オリジナルス,Retropy E5,"7,150",リサイクル素材を一部使用した、70's風のモダンな履き心地の一足。
